uuid,title,opening,type,coding
77462828-4604-4aa4-81a3-c526987e9b57,Letter containing white powder sent to Donald Trump Jr.'s home,"Emergency crews responded Monday after a letter containing an unidentified white powder was sent to the Florida home of Donald Trump Jr., the eldest son of form...",6,Positive
9b02b9ef-827a-4f32-95f7-e5defe05fd22,"Charlie Kirk memorial service set for Sunday with Trump, Vance to speak",Tens of thousands of mourners are expected to pack Arizona's State Farm Stadium.  A makeshift memorial for Charlie Kirk outside the headquarters of Turning Poin...,6,Neutral
ca01a572-d698-49f9-b52f-888ca40cadc5,Video RFK Jr. joins Trump at Arizona rally after dropping out of race,RFK Jr. joins Trump at Arizona rally after dropping out of race Robert F. Kennedy Jr. suspended his presidential campaign on Friday and endorsed former Presiden...,2,Positive
c861e230-77a4-4b82-9c7c-4e217c5f4a93,Democrats' chair says Trump's win forces party to reassess how it reaches voters,The outgoing Democratic National Committee chairman is downplaying his party’s November loss to President-elect Donald Trump and arguing Democrats avoided eve...,5,Positive
1ae1b779-9c29-4ef0-a100-b7262a595882,"As speculation mounts on Trump's running mate, contenders pitch the base at CPAC","""I think it's wide open,"" one expert said. ""Trump keeps his cards very close.""  The annual Conservative Political Action Conference has long been a proving grou...",2,Neutral
90a89e82-0fa5-4727-9b39-f089ea5d0c71,Fact checking the Biden-Trump presidential debate,"President Joe Biden and former President Donald Trump met for a showdown over policy and their records, but not everything claimed by the candidates onstage was...",2,Neutral
c6b7f778-b527-4905-93e7-9d44bfa573b5,Major media organizations urge Biden and Trump to debate,ABC News and other major TV networks sent a letter to the candidates Sunday.  ABC News is among a unified grouping of the five chief broadcast and cable news ne...,5,Neutral
c7e0ba47-e113-42ae-b58d-761fd4f1dae4,"Trump overstepped his constitutional authority in freezing Congress' funding for USAID, judge says",A federal judge says President Donald Trump overstepped his authority in freezing almost all spending on U.S. humanitarian and development work abroad  Presiden...,1,Negative
eeb90bf8-a34c-472e-a9f9-fec0f60d490f,"Adelson adding NBA team to resume of casino mogul, GOP power broker, US and Israel newspaper owner","FILE - Miriam Adelson, wife of Las Vegas Sands Corporation Chief Executive and Republican mega donor Sheldon Adelson, listens as President Donald Trump speaks a...",6,Neutral
14d51b0b-d25b-4a18-a258-3955c6fa2c1c,Democrats slam Trump's 'insane' Gaza plan as supportive Republicans await details,"Speaker of House Mike Johnson speaks at a press conference at the U.S. Capitol Feb. 5, 2025 in Washington.  Speaker of House Mike Johnson speaks at a press conf...",5,Negative
037e8e93-3495-4335-855c-5beb9c06c3ab,Trump says US has secured $17T in new investments. The number is likely much less.,"President Donald Trump claims his policies have generated $17 trillion in new investments, but the real number is likely much less  Trump says US has secured $1...",4,Negative
49355849-00b7-49d1-9003-6509499d5d51,Trump takes unusual stroll on White House roof,"President Donald Trump gestures to the media from the roof of the West Wing at the White House in Washington, Aug. 5, 2025.  President Donald Trump gestures to ...",3,Positive
f20c6f4c-b8b5-4d3c-8360-be6f23d8c265,Critical US-Iran nuclear talks on shaky ground,"President Donald Trump in Washington, May 30, 2025 and Iranian supreme leader Ayatollah Ali Khamenei in Tehran on June 4, 2025.  President Donald Trump in Washi...",4,Neutral
72da8e49-c6f4-4e20-b944-7f73aa54ba5d,Trump is making the Jan. 6 attack a cornerstone of his bid for the White House,"Donald Trump is making the Jan. 6, 2021, attack on the Capitol a cornerstone of his bid to return to the White House  Trump is making the Jan. 6 attack a corner...",2,Negative
73e471a5-fd43-4400-bce1-ebd0e4726c98,How bunker-busters and B-2 stealth bombers struck at the heart of Iran's nuclear program,"How bunker-busters and B-2 stealth bombers struck at the heart of Iran's nuclear program  President Donald Trump, Chairman of the Joint Chiefs of Staff, General...",4,Neutral
9946f94f-3a03-4307-9c7e-d986791ef773,"Trump tells ABC News assassination attempt 'has an impact,' Biden 'couldn't have been nicer'",Former President Donald Trump said the assassination attempt on his life over the weekend has left an impact.  In a phone call with ABC News' Chief Washington C...,3,Positive
6fdb11a8-44bc-45fc-a757-978ac21704f8,"Long before getting booted from Trump's speech, Rep. Al Green called for the president's impeachment","Green said ""there are times when it is better to stand alone.""  Long before getting booted from Trump's speech, Rep. Al Green called for the president's impeach...",5,Negative
4f70cb66-1d8b-44d4-b54c-aa5881bcd1a6,"Now that Donald Trump has been convicted, what happens next?","Donald Trump is scheduled to be sentenced in July before he can appeal the case.  Now that Donald Trump has been convicted, what happens next?  Former President...",1,Negative
e44718ba-9453-4662-b390-4d17b72afde9,"After hitting Ukraine hard on peace talks, how far will Trump go to pressure Putin?","Trump said he could ""financially"" hit Moscow but that he preferred not to.  After hitting Ukraine hard on peace talks, how far will Trump go to pressure Putin? ...",4,Neutral
5716fb26-9abf-41d7-8bdb-833dce7c8dde,The GOP is trying again to cut Medicaid. It's only gotten harder since 2017,"Republicans again have their eyes on Medicaid, the government health program.  The GOP is trying again to cut Medicaid. It's only gotten harder since 2017  Pres...",4,Neutral
ab6513a4-3648-44f0-b309-8603f588b7d2,Donald Trump wins the Republican presidential primary in Tennessee,Colorado secretary of state after SCOTUS Trump ruling: ‘I did not bring this lawsuit’,2,Neutral
518374d7-7894-4f49-9c05-e33225df6650,"Trump confronts South Africa's president in Oval Office, pushes claims of 'genocide' against white farmers",He showed videos and articles he said proved his claims.  President Donald Trump meets with South African President Cyril Ramaphosa in the Oval Office of the Wh...,4,Neutral
f8e2e03e-3b5b-4240-ace3-a2b174ba1ea6,Senate deal on border and Ukraine at risk of collapse as Trump calls it 'meaningless',"Senate deal on border and Ukraine at risk of collapse as Trump calls it 'meaningless'  Sen. James Lankford, R-Okla., the lead GOP negotiator on a border-foreign...",4,Negative
86241952-4350-4a0c-a182-ee9310064039,Trump vows to take on crime in Chicago 'fast' after violent Labor Day weekend,"Trump vows to take on crime in Chicago 'fast' after violent Labor Day weekend  Donald Trump returns to the White House on September 1, 2025 in Washington, DC.  ...",4,Neutral
dd248199-e5be-4df9-8838-c3ac96b665c3,"Harris paints Trump as threat, draws contrast with Biden in combative Fox News interview",Vice President Kamala Harris on Wednesday hammered former President Donald Trump as thin-skinned and a threat to U.S. democracy in a combative interview with Fo...,2,Negative
d17331c4-ce7d-45ed-a9d4-1b381de68a67,"Running for U.S. president from prison? Eugene V. Debs did it, a century ago","Following his unprecedented felony conviction, former president and current presumptive Republican nominee Donald Trump has to wait to find out what his sentenc...",2,Negative
8fb56c20-ce5e-43a1-85c9-36beeccad9e7,"Harris and Trump face major challenges, risks on Tuesday's presidential debate stage",Vice President Kamala Harris and former President Donald Trump will need to navigate the pitfall-filled debate of their political lives on Tuesday as each tries...,2,Neutral
6b3ba85d-585b-4366-bf35-b9b9057c6bc2,Trump will visit the Kennedy Center as he puts his mark on national arts institution,President Donald Trump will visit the John F. Kennedy Center for the Performing Arts on Monday afternoon  Trump will visit the Kennedy Center as he puts his mar...,4,Positive
a92e118e-235e-4d54-bfd8-1624b0337b54,"Trump questions if NATO would defend US, but 1,000 allies were killed in the war on terror","NATO's Article 5 was invoked only once -- after the 9/11 attacks on the US.  Trump questions if NATO would defend US, but 1,000 allies were killed in the war on...",4,Negative
24d74a12-a6c2-4c38-b027-08d4bcb2cb47,Leader of Belarus opposition warns Trump: Beware of her nation's president,The exiled head of Belarus’ opposition told The Associated Press that she thinks the country's iron-fisted leader Alexander Lukashenko wants to fool U.S. Pres...,4,Neutral
2eeec855-e31a-40a5-ad2c-0fded2353365,President Donald Trump's policies spark protests in multiple US cities on Labor Day,"Protesters took to the streets of Chicago, New York, San Francisco and Washington D  Demonstrators protest against President Donald Trump's use of federal law e...",5,Negative
6f9f7438-8eeb-48de-bc50-5675ea223899,Backdrop for Trump's speech to Congress is a potential government shutdown,"The deadline for a funding agreement is just days away on Friday, March 14.  President Donald Trump arrives to speak to members of the media in the Roosevelt Ro...",4,Neutral
34742792-6c3b-41a2-b156-b071f5346ac9,Special counsel suspected additional obstruction effort by Trump in classified docs case,The allegations were revealed in a newly unsealed court filing Tuesday.  Special counsel Jack Smith appears to have suspected additional efforts by former Presi...,1,Negative
62d0eca4-b909-45b7-9133-a8353ea4c85d,"Macron warns Trump to 'be careful' on Ukraine, fact-checks him at the White House","The French leader interrupted Trump while he repeated grievances about U.S. aid.  Macron warns Trump to 'be careful' on Ukraine, fact-checks him at the White Ho...",5,Negative
e6e116fd-b147-4f17-bea7-bb1ca11beddb,Prosecutors defer to judge on delaying Donald Trump's sentencing date in hush money case,Trump had been scheduled to be sentenced on Sept. 18.  Prosecutors in New York are taking no position on former President Donald Trump's request to delay senten...,1,Neutral
f1c709b7-15c8-4be7-9b27-6870139c50fe,Donald Trump endorses Ohio congressional candidate Derek Merrin just hours before polls open,"Former President Donald Trump has issued a last-minute endorsement in a highly sought northwest Ohio congressional district, backing state Rep. Derek Merrin as ...",2,Positive
80b85708-e9ed-4f36-b899-944bed038a9a,Trump suggests more cities need National Guard but crime stats tell a different story,President Donald Trump has threatened to deploy the National Guard to Chicago and other big cities as a way to fight crime  President Donald Trump has threatene...,4,Negative
d3aeb4ba-1a39-4f61-9436-528199a4266a,Trump seeks presidential immunity from any civil lawsuit filed against him in state court,The president is being sued by two co-founders of his Trump Media company.  In a case that sits squarely at the intersection of his business and political inter...,1,Negative
c7eb3df6-bae4-45e7-aaef-d16ead7ae8d8,"Video Donald Trump wins 2nd term in historic return to White House, ABC News projects","Trump casts his vote in Florida, says it will be his last campaign",2,Positive
a11b961b-63e8-42d4-b3bd-4e73925df6db,Here's a look inside Donald Trump's $355 million civil fraud verdict as an appeals fight looms,"On the witness stand last year, Donald Trump proclaimed: “I have a lot of cash.”  NEW YORK -- On the witness stand last year, Donald Trump proclaimed: “I ...",1,Negative
dfeed6e0-cd8b-4fad-b819-b55c0f471ab9,Former government ethics director warns of corruption danger,"Elon Musk listens to President Donald Trump speak in the Oval Office of the White House in Washington, D.C., Feb. 11, 2025.  Elon Musk listens to President Dona...",5,Negative
c0a58caf-5563-4ecf-8f4a-b345c325d0ec,Here's what to know about chronic venous insufficiency,The left foot and swollen of President Donald Trump are pictured as he sits with Bahrain's Crown Prince Salman bin Hamad Al Khalifa in the Oval Office of the Wh...,3,Neutral
d4f4dccf-07fc-4e12-8c4c-72f819028807,Orbán tells Trump dropping Russian energy would bring economy 'to its knees',Hungarian Prime Minister Viktor Orbán says Hungary will keep buying fossil fuels from Russia despite demands from President Donald Trump  FILE - President Dona...,5,Neutral
a607d5ed-0c8f-4a41-a821-6b25e3b0808a,Trump asks to dismiss Georgia election interference case over presidential immunity,Trump's attorney wants an appeals court to order the case dismissed.  Donald Trump's Georgia election interference case should be dismissed because a sitting pr...,1,Neutral
b6c3a0c3-fab4-45de-b22f-76bf306697f1,Video Canadian hockey fans boo US national anthem after Trump imposes tariffs,Canadian hockey fans boo US national anthem after Trump imposes tariffs Ottawa Senators fans could be heard booing the U.S. national anthem before Saturday nigh...,5,Negative
23a9c12b-fbcd-460c-a469-dd5c347039bc,Ohio Gov. Mike DeWine bypasses Trump-backed Bernie Moreno with US Senate primary endorsement,Republican Ohio Gov. Mike DeWine has parted ways with Donald Trump to endorse state Sen. Matt Dolan over Trump-backed businessman Bernie Moreno in the three-way...,2,Negative
b688bb7d-ef54-4166-a81d-c9130e51bb87,Trump seeks to use Canada's recognition of Palestinian state as leverage in trade talks,President Donald Trump says Canada’s announcement it'll recognize a Palestinian state “will make it very hard” for the U.S. to reach a trade agreement wit...,4,Neutral
a3b07707-5572-4898-8544-0084b3b96342,"Video Trump puts DC police department under federal control, deploys National Guard","Trump puts DC police department under federal control, deploys National Guard President Donald Trump announced that he is placing the D.C. Metropolitan Police D...",4,Neutral
beaedea0-a98e-4f26-9135-befabc40b335,Donald Trump wins the Republican presidential caucuses in Alaska,Colorado secretary of state after SCOTUS Trump ruling: ‘I did not bring this lawsuit’,2,Neutral
66c79db9-6ff1-4af9-88f2-e9e199717c8c,Trump defense secretary pick Pete Hegseth was flagged as potential military 'insider threat' because of 'Deus Vult' tattoo,Sgt. DeRicko Gaither made the complaint about the tattoo in 2021.  Trump defense secretary pick Pete Hegseth was flagged as potential military 'insider threat' ...,6,Negative
e3d3e250-c1f1-4b9a-9f45-86ace0ad26c2,Trump says Senate should scrap the filibuster to end the government shutdown.,Add AP News as your preferred source to see more of our stories on Google.  WASHINGTON (AP) — President Donald Trump is calling on the Senate to scrap the fil...,4,Neutral
a6488289-147b-44c4-a974-547d43123f51,Mexico makes case to avoid US tariffs as it awaits Trump’s decision,MEXICO CITY (AP) — Mexico President Claudia Sheinbaum said Monday that her administration is waiting to see if U.S. President Donald Trump makes good on his t...,5,Neutral
0993a935-283d-4215-9630-22fe32b4d511,Appeals court again upholds gag order barring Donald Trump from commenting about judge’s staff,"NEW YORK (AP) — A New York appeals court has again upheld a gag order that bars Donald Trump from commenting about court personnel in his civil fraud trial, r...",1,Negative
41e56ecb-dcc0-4dae-a5d9-ea45d9a85bdf,Trump visiting Gulf Arab states while crises flare in Gaza and Iran,"DUBAI, United Arab Emirates (AP) — On his trip this week to the Middle East, U.S. President Donald Trump will visit Saudi Arabia, Qatar and the United Arab Em...",4,Neutral
862a19ed-27a8-441d-9f36-b3ca94d58c6e,Trump will attend the wake of a slain New York police officer as he goes after Biden over crime,"NEW YORK (AP) — Donald Trump will attend Thursday’s wake of a New York City police officer gunned down in the line of duty, as the presumptive Republican pr...",2,Neutral
1a47df40-683d-454e-8934-4306413bbbb6,Trump and Harris keep campaigning after Milton hits Florida,"WASHINGTON (AP) — Vice President Kamala Harris visits Nevada and Arizona while former President Donald Trump talks economic issues in Michigan, as presidentia...",2,Neutral
511347e6-16db-4e07-a4d4-c58e63275627,DeSantis signs sweeping immigration laws for Florida as states rush to fulfill Trump’s agenda,Associated Press/Report for America (AP) — Florida Gov. Ron DeSantis signed a sweeping package of immigration laws on Thursday aimed at carrying out President...,4,Neutral
8a2846d0-b175-4632-8e5c-1c0e166fe468,Body camera footage shows local police anger at Secret Service after Trump assassination attempt,"WASHINGTON (AP) — In the chaotic aftermath of the attempted assassination of Donald Trump at a Pennsylvania rally last month, a local police officer told a fe...",5,Positive
deaace23-e275-45d5-b614-d144cabfca83,The Latest: Trump wants to scrap the filibuster to end the government shutdown,"Add AP News as your preferred source to see more of our stories on Google.  President Donald Trump is calling on the Senate to scrap the filibuster, so that the...",4,Neutral
151e8265-451d-4768-995e-a432a5daef1f,Trump is set to announce ‘reciprocal’ tariffs in a risky move that could reshape the economy,"WASHINGTON (AP) — After weeks of White House hype and public anxiety, President Donald Trump is set Wednesday to announce a barrage of self-described “recip...",4,Negative
7ff62d90-2dd7-4dfd-a5d0-938ab4bea9e1,Donald Trump booed as the 1st sitting US president at a regular-season NFL game since Carter in 1978,"Add AP News as your preferred source to see more of our stories on Google.  LANDOVER, Md. (AP) — Donald Trump became the first sitting president in nearly a h...",3,Negative
f44e829d-2c3e-4324-becd-5522acbcc1f9,These Republicans won states that Trump lost in 2020. Their endorsements are lukewarm (or withheld),ATLANTA (AP) — Georgia Gov. Brian Kemp will back his fellow Republicans’ presidential ticket in November. That does not mean he will cheerlead for former Pr...,2,Negative
4807e5df-3df4-48a4-b245-6f7d6e54a975,"Senate confirms Marco Rubio as secretary of state, giving Trump the first member of his Cabinet","WASHINGTON (AP) — The Senate quickly confirmed Marco Rubio as secretary of state Monday, voting unanimously to give President Donald Trump the first member of...",4,Positive
8eb3ab1f-8172-4b2d-b897-78df54c0b8a3,"Trump will visit the Justice Department, months after his criminal prosecutions were dismissed","WASHINGTON (AP) — President Donald Trump is set to visit the Justice Department on Friday to rally support for his administration’s tough-on-crime agenda, a...",4,Positive
a81af646-ee7b-437e-bec2-72cb8ea1e125,Trump administration officials say Secret Service is investigating Comey’s ’86 47' social media post,WASHINGTON (AP) — Homeland Security Secretary Kristi Noem said Thursday that federal law enforcement is investigating a social media post made by former FBI D...,4,Neutral
d03d9e2d-320d-4f61-99f5-6f4fdb26df7a,Russia’s top diplomat praises Trump’s views on Ukraine conflict,MOSCOW (AP) — Russia’s top diplomat said Tuesday that Moscow is open for talks with President-elect Donald Trump and praised him for pointing to NATO’s pl...,4,Negative
50747bd1-31f8-4f1b-9671-977f6b37e2fa,Trump administration moves to drop Idaho emergency abortion case with national implications,WASHINGTON (AP) — The Trump administration on Wednesday moved to drop an emergency abortion case in Idaho in one of its first moves on the issue since Preside...,4,Neutral
002696b7-7f5e-4505-bc8d-cd1f413caf6a,"Trump avoids ‘corporate death penalty’ in civil fraud case, but his business will still get slammed",NEW YORK (AP) — Donald Trump won’t face the corporate death penalty after all.  A New York judge on Friday spared the ex-president that worst case punishmen...,1,Negative
14f83887-6903-49ca-94ff-3742a29d0fe6,Russia rejoices at Trump-Putin call as Zelenskyy says he won’t accept a deal without consultation,"KHMELNYTSKI, Ukraine (AP) — Russian officials and state media took a triumphant tone Thursday after U.S. President Donald Trump jettisoned three years of U.S....",4,Negative
5609195a-394a-4ecc-b2c0-df0e6b34eb28,Why a full federal takeover of DC would require an act of Congress,"WASHINGTON, D.C. (AP) — The moment that local officials in Washington have been dreading for months is finally here. President Donald Trump, one month into hi...",4,Neutral
e7ab437c-1309-4692-948f-a8487f732b76,Ex-President Donald Trump set to face jury over sex abuse and defamation claims,"NEW YORK (AP) — After a big victory in the Iowa caucus, former President Donald Trump is expected in court Tuesday to face another legal challenge: a trial to...",1,Negative
25c8d783-04f5-45bc-9d0e-8ec05dc0f8b8,What’s next for the Epstein files after Trump’s social media posts,Add AP News as your preferred source to see more of our stories on Google.  Add AP News on Google Add AP News as your preferred source to see more of our storie...,5,Neutral
68f91585-0e77-4334-9bb8-850a9affd7c5,DeSantis promotes his wife as next Florida governor and takes a shot at Trump’s pick,"TALLAHASSEE, Fla. (AP) — As Florida Gov. Ron DeSantis approaches the end of his second term in office, he’s talking up one potential heir to succeed him in ...",6,Negative
16ffeb5e-0c56-4414-9390-c8fb7661284b,Trump unveils deal to expand coverage and lower costs on obesity drugs,Add AP News as your preferred source to see more of our stories on Google.  WASHINGTON (AP) — President Donald Trump unveiled a deal Thursday with drugmakers ...,4,Positive
2cbd9035-7d41-4fc3-b906-15f6541ac8b3,Trump thinks owning a piece of Intel would be a good deal for the US. Here’s what to know,"SAN FRANCISCO (AP) — President Donald Trump wants the U.S. government to own a piece of Intel, less than two weeks after demanding the Silicon Valley pioneer ...",4,Neutral
aa4bd693-cff9-4d0f-814b-95b259ffea71,Europe lashes out over Trump auto tariffs and the economic threat to both continents,"FRANKFURT, Germany (AP) — European automakers, already struggling with tepid economic growth at home and rising competition from China, on Thursday decried th...",4,Negative
7628dbb5-9bdf-48a7-9081-110970d3e2ec,"Trump is heading to Capitol Hill to persuade divided GOP to unify around his ‘big, beautiful’ bill","WASHINGTON (AP) — President Donald Trump is heading to Capitol Hill early Tuesday to seal the deal on his “big, beautiful bill,” using the power of politi...",4,Neutral
2a5807be-3d63-4182-844b-d63baf7a3255,Dueling pro-Trump factions in Michigan throw the swing state’s Republicans into disarray,"WATERFORD TOWNSHIP, Mich. (AP) — The Michigan Republican Party was deep in debt when a longtime party donor who had given more than $1 million over the past d...",2,Negative
7a603f0a-2a39-4dce-82a2-a40cafdcc412,Trump skips much of the final week before Iowa’s caucuses to go to court voluntarily instead,"DES MOINES, Iowa (AP) — While his rivals contend with snow drifts and frigid temperatures as they make their last-ditch pitch to Iowa voters, former President...",2,Negative
09755464-0582-4eec-b658-0d508f990ef6,Trump builds White House staff with Cheung as communications director and Gor as personnel director,WASHINGTON (AP) — President-elect Donald Trump announced Friday that Steven Cheung will serve as his White House communications director and Sergio Gor will r...,4,Neutral
3e4d0851-1460-49eb-b5a2-a38e23526706,"Trump may testify in sex abuse defamation trial, but the court has limited what he can say","NEW YORK (AP) — Former President Donald Trump has told the public for years what he thinks of E. Jean Carroll, the writer who claims he sexually assaulted her...",1,Negative
b7f0a4a7-dd74-4116-a079-2620b2372490,What is the Laken Riley Act? A look at the first bill Trump will sign,"President Donald Trump is poised to sign the first bill of his new administration, and it is named after a slain Georgia nursing student whose name became a ral...",4,Neutral
bf46f887-1600-42b8-9b45-21c41ef744f4,Why AP called Iowa for Trump: Race call explained,WASHINGTON (AP) — Former President Donald Trump scored the first victory of the 2024 presidential primary season Monday with a sweeping and broad-based win in...,5,Neutral
9448ff01-e809-478c-acc8-32af07fad1c2,"Trump says he’ll send troops to Portland, Oregon, to handle ‘domestic terrorists’","WASHINGTON (AP) — President Donald Trump said Saturday he will send troops to Portland, Oregon, “authorizing Full Force, if necessary” to handle “domest...",4,Neutral
9f8a8bb3-9e84-4d59-8a27-22a5aa73f205,Iran denies aiding Yemen’s Houthi rebels after US strikes and threat from Trump,CAIRO (AP) — Iran on Sunday once again denied aiding Yemen’s Houthi rebels after the United States launched a wave of airstrikes against them and President ...,4,Neutral
efcb1b96-c786-49bd-a9bf-3df1901d6c3a,Trump returns to campaign trail with VP deadline nearing amid calls for Biden to withdraw,"MIAMI (AP) — Former President Donald Trump is getting back on the campaign trail Tuesday, rallying voters in his home state at his flagship golf resort in a c...",2,Neutral
05cad9ce-8f30-4f4b-907a-de0ef63fa136,"Secretary of State Rubio says purge of USAID programs complete, with 83% of agency’s programs gone",▶ Follow live updates on President Donald Trump and his new administration.  WASHINGTON (AP) — Secretary of State Marco Rubio said Monday the Trump administ...,4,Neutral
368d8c8f-9da0-411d-853e-775f47c97405,Panama president calls Trump’s talk of ‘reclaiming’ the Panama Canal a lie,PANAMA CITY (AP) — Panama President José Raúl Mulino on Wednesday accused U.S. President Donald Trump of lying when he said in his address to Congress that ...,5,Negative
