uuid,title,opening,type,coding
43f97eb7-032e-48df-9fcf-66b1e175c3f5,"Man who set himself on fire outside Trump trial dies of injuries, police say",NEW YORK (AP) — A man who doused himself in an accelerant and set himself on fire outside the courthouse where former President Donald Trump is on trial is on...,5,Neutral
d8fafc4e-db0d-4c99-a2a2-fb4db1964162,Republicans once railed against armed IRS agents. Now they want them for immigration enforcement,"WASHINGTON (AP) — For years, Republicans, including President Donald Trump, have railed against the IRS and its cadre of armed agents. Now the administration ...",4,Neutral
8c36a19d-89d4-450d-8afe-4a19617b1954,The White House is weighing executive actions on the border — with immigration powers used by Trump,WASHINGTON (AP) — The White House is considering using provisions of federal immigration law repeatedly tapped by former President Donald Trump to unilaterall...,6,Neutral
f66eeb05-ce08-466e-81ad-36bf58e745e8,Strange sell-off in the dollar raises the specter of investors losing trust in the US under Trump,"NEW YORK (AP) — Among the threats tariffs pose to the U.S. economy, none may be as strange as the sell-off in the dollar.  Currencies rise and fall all the ti...",4,Negative
6649a58a-63a3-4f89-83a1-cc88e5e07569,Trump attorneys post bond to support $83.3 million award to writer in defamation case,NEW YORK (AP) — Former President Donald Trump has secured a bond sufficient to support an $83.3 million jury award granted to writer E. Jean Carroll during a ...,1,Negative
6b7f53b0-32a3-43f1-9fb6-5ce5764329cf,Trump revokes Secret Service protection for former Vice President Harris after Biden had extended it,▶ Follow live updates on President Donald Trump and his administration  WASHINGTON (AP) — President Donald Trump has revoked Secret Service protection for f...,4,Neutral
27c1758a-10db-4d71-b35a-82b6f6a0627f,Democrats dislike the ‘chaos’ of Trump’s trade war but are OK with some tariffs,"WASHINGTON (AP) — Democrats are quick to say that President Donald Trump’s tariffs are horrible, awful, terrible. But Democrats are also stressing that they...",5,Negative
0a842eab-e834-4c61-8519-b8061c12ca39,Trump’s education secretary may be asked to dismantle the Education Department. Here’s what it does,"WASHINGTON (AP) — If Linda McMahon is confirmed as education secretary, President Donald Trump has said he wants her to “put herself out of a job.”  A pla...",4,Neutral
340ce5f5-a67c-4f55-b29b-6333eae63b7e,Trump doubles planned tariffs on Canadian steel and aluminum to 50% as trade war intensifies,▶ Follow live updates on President Donald Trump and his new administration.  WASHINGTON (AP) — President Donald Trump said Tuesday that he will double his p...,4,Neutral
58f6d6de-09d0-491c-9888-c02833d8c39f,"Rally shooter had photos of Trump, Biden and other US officials on his phone, AP sources say","WASHINGTON (AP) — The 20-year-old Pennsylvania man who tried to assassinate Donald Trump had photos on his phone of the former Republican president, President...",6,Neutral
a1212f61-1f90-4264-a2b8-e10984abac41,NATO head and Trump meet in Florida for talks on global security,"BRUSSELS (AP) — U.S. President-elect Donald Trump and the head of NATO have met for talks on global security, the military alliance said Saturday.  In a brief...",4,Neutral
90df4ed0-f4ed-4246-b91f-926075d67e43,"Episcopal bishop says she’ll continue to pray for Trump, who lashed out at her over viral sermon","WASHINGTON (AP) — The Right Rev. Mariann Edgar Budde, bishop of the Diocese of Washington, said Wednesday that she will continue to pray for President Donald ...",5,Negative
2e2e2492-0cc7-4254-bd42-b8bff72a8f30,World shares are mixed ahead of meeting between Trump and Putin,"MANILA, Philippines (AP) — World shares were mixed Thursday ahead of a key meeting between U.S. President Donald Trump and Russian President Vladimir Putin at...",4,Neutral
3efe354c-72a1-44bf-9e89-ea25ed0177d1,Trump’s pick to lead the RNC is facing skepticism from some Republicans,"WASHINGTON (AP) — In pushing Michael Whatley as the next leader of the Republican National Committee, Donald Trump zeroed in on the North Carolina GOP chairma...",2,Negative
f956ded9-eff2-4f3a-8c41-31640746eafe,"With bombs and bravado, Trump puts his own stamp on Reagan’s ‘peace through strength’ mantle","Add AP News as your preferred source to see more of our stories on Google.  WEST PALM BEACH, Fla. (AP) — It wasn’t so long ago that President Donald Trump s...",4,Negative
13af1014-e596-48b8-a9b9-6edd978cbbaa,Zelenskyy to visit Berlin for meetings ahead of Trump-Putin summit,BERLIN (AP) — Ukrainian President Volodymyr Zelenskyy will visit Berlin on Wednesday to join German Chancellor Friedrich Merz for talks with European and U.S....,6,Neutral
68503c1b-c3b6-4cfa-b680-8b2db52469e8,Trump’s sharp tariff hikes could speed up China’s shift to new markets and offshore factories,"YIWU, China (AP) — Visitors who bought fridge magnets at Times Square or other tourist hotspots around New York in recent years most likely were purchasing th...",4,Negative
845cb63c-c070-4d18-be0f-ea39e2b7b0ef,Trump tours Boeing plane to highlight aircraft maker’s delay in delivering a new Air Force One,"WEST PALM BEACH, Fla. (AP) — President Donald Trump toured a Boeing airplane to check out new hardware and technology features and highlight the aircraft make...",4,Neutral
4712ca25-cd8b-4184-8b02-00ba3168892c,"Biden and Trump will meet in the Oval Office on Wednesday, the White House says",Follow AP’s coverage of the presidential election.  WASHINGTON (AP) — President Joe Biden will host President-elect Donald Trump for a traditional postelect...,2,Neutral
b80e671c-0bb3-47d8-bef2-77f69e367d37,"Experts worry that Trump’s Jan. 6 pardons will legitimize political violence, embolden extremists","WASHINGTON (AP) — After President Donald Trump pardoned around 1,500 Jan. 6 Capitol rioters on Monday, far-right activists cheered the move and said it streng...",5,Negative
21fe8062-4e31-4d05-96c9-8d2855471298,Trading Trump: Truth Social’s first month of trading has sent investors on a ride,"WASHINGTON (AP) — There have been lawsuits, short-selling and rampant speculation. Now, as Trump Media & Technology Group approaches its first month as a publ...",3,Neutral
66691175-d33e-4354-a7f3-4d0b3ab25270,Trump defends controversial comments about immigrants poisoning the nation’s blood at Iowa rally,"WATERLOO, Iowa (AP) — Former President Donald Trump on Tuesday defended his comments about migrants crossing the southern border “poisoning the blood” of ...",2,Negative
5c23fabe-2039-460c-b7ce-d9e9a9421aad,EPA grants California authority to ban sales of new gas cars by 2035. Action faces reversal by Trump,"WASHINGTON (AP) — The Environmental Protection Agency on Wednesday granted two requests from California to enforce strict standards for vehicle emissions, inc...",4,Neutral
599023f4-e5ae-432a-a43a-829a9bbe88bf,Trump says he will meet with Narendra Modi during Indian prime minister’s visit to US,"FLINT, Mich. (AP) — Former President Donald Trump said Tuesday that he’s meeting next week with Indian Prime Minister Narendra Modi when Modi visits the U.S...",4,Neutral
1514bb6f-f3b0-4ccf-a837-b057e3cb2b89,Trump says he’ll set 30-day deadline for drugmakers to lower the cost of prescription drugs,▶ Follow live updates on President Donald Trump and his administration  WASHINGTON (AP) — President Donald Trump said he will set a 30-day deadline for drug...,4,Positive
df65fe8d-9e54-4e58-ba59-a02b6d7f69fa,Trump says he may withhold federal aid for Los Angeles if California doesn’t change water policies,WASHINGTON (AP) — President Donald Trump on Wednesday threatened to withhold federal disaster aid for wildfire-ravaged Los Angeles unless California leaders c...,4,Negative
03256135-a712-4f68-9f35-e7ddb04f889c,Trump’s tariff tactics carry higher economic risks than during his first term,"WASHINGTON (AP) — When Donald Trump started the biggest trade war since the 1930s in his first term, his impulsive combination of threats and import taxes on ...",4,Negative
ab9ca584-794c-4ed4-aabb-6b57eb0f8a35,US moves ahead on tariffs with investigations into computer chips and pharmaceuticals,"BANGKOK (AP) — The Trump administration has taken its next steps toward imposing more tariffs on key imports, launching investigations into imports of compute...",4,Neutral
75b24b57-1638-4f92-adb1-f9e666c3541a,1 million migrants in the US rely on temporary protections that Trump could target,"NEW YORK (AP) — Maribel Hidalgo fled her native Venezuela a year ago with a 1-year-old son, trudging for days through Panama’s Darien Gap, then riding the r...",4,Negative
774e99c7-4afa-4ee3-b144-e7c94aa596bc,"The Navy secretary broke the law by voicing his views on Trump and Biden, a watchdog says",WASHINGTON (AP) — Navy Secretary Carlos Del Toro broke the law by publicly endorsing the reelection of President Joe Biden and criticizing former President Do...,5,Neutral
b73f5ee5-808c-4f48-aeb2-26de594b0822,USAID workers will be given 15 minutes to clear their workspaces as the agency gets dismantled,WASHINGTON (AP) — Thousands of U.S. Agency for International Development workers who have been fired or placed on leave as part of the Trump administration’...,4,Negative
32f38251-ecb0-4cbf-8c0e-8de1bdd59feb,Lawmakers are concerned about background checks of Trump’s Cabinet picks as red flags surface,"WASHINGTON (AP) — As senators prepare to consider President-elect Donald Trump’s picks for his Cabinet, they may be doing so without a well-established stap...",4,Negative
554f9ee5-3ae1-4671-9da1-f1a6c0374c58,White House unveils letter President Donald Trump will send to new US citizens,NEW You can now listen to Fox News articles!  FIRST ON FOX: The Department of Homeland Security and the U.S. Citizenship and Immigration Services agency (USCIS)...,4,Positive
c735d657-c9e9-40ba-8b33-da1045f5729b,Claire McCaskill laments that Hunter Biden pardon gives 'ammunition' to Republicans: 'I just hate it',"Former Democratic Sen. Claire McCaskill on Monday lamented the ""ammunition"" President Biden’s decision to pardon his son Hunter will give to Trump world.  ""Wh...",5,Neutral
5ae55c6c-c8c9-4972-a168-047663d93911,"Fox News Sports Huddle Newsletter: Trump makes rare NFL appearance, trans athlete challenges SCOTUS case",NEW You can now listen to Fox News articles!  Welcome to the Fox News Sports Huddle Newsletter.  LEGAL BATTLE – The family of a transgender athlete filed a br...,3,Neutral
ec356fa7-8b80-4886-b40b-fa95a49fdf7c,BRYAN DEAN WRIGHT: John Brennan was my boss at the CIA. He belongs in prison,NEW You can now listen to Fox News articles!  Former CIA Director John Brennan was once my boss. Given what we just learned in a shocking new report about his r...,5,Neutral
5349e892-da10-4fce-9d04-22cee31dd4cd,Trump dishes on Milley clash over leaving military equipment in Afghanistan: 'I knew he was an idiot',NEW You can now listen to Fox News articles!  President Donald Trump disclosed he and former Chairman of the Joint Chiefs of Staff Gen. Mark Milley clashed over...,4,Neutral
27429c25-1d9c-47f0-9670-0db8c89d2e08,"Joe Manchin says Donald Trump can win, wants to make the GOP ‘grand again’","A Democratic senator told Fox News former President Trump can win in November and said the Republican Party needs to be made ""grand again"" while the Democratic ...",2,Positive
63a42da8-86dd-4dbe-984c-1fce8d28e905,"Eric Trump warns Bragg, Willis 'want to torture my father' but no one 'is believing it'","Eric Trump is standing behind his father as legal efforts ramp up against him, most notably in the NY v. Trump trial that's underway in Manhattan. The vice pres...",6,Positive
37fa7aa0-75a2-491a-a523-b2d2d7b1ddbb,Harris supporter Stephen Curry holds no 'ill will' after Trump's victory,Stephen Curry was likely not thrilled in the late hours of Tuesday night and early hours of Wednesday morning.  The future Hall of Famer endorsed Kamala Harris ...,5,Neutral
1bae0a64-9850-40c4-a3cc-a1c589618383,"MSNBC's Al Sharpton, Donny Deutsch 'convinced' they'll be put on enemy's 'list' if Trump elected","MSNBC host Al Sharpton and frequent guest Donny Deutsch expressed fears Friday that Donald Trump would place them on an enemy's ""list"" if he was elected preside...",5,Negative
d258e04c-1948-46db-a98a-153b1639f5b0,Zelenskyy touts 'fruitful' Trump call after US president was 'disappointed' by Putin talk,"NEW You can now listen to Fox News articles!  Ukrainian President Volodymyr Zelenskyy said Friday that he had a ""very important and productive"" phone call with ...",4,Positive
053ea52b-8da9-41b7-af9f-0184d70ef507,Trump hints he will appear on Joe Rogan podcast: 'I think I'm doing it',"Former President Donald Trump hinted during an appearance on the podcast with the Nelk boys' ""Full Send"" podcast that he would be sitting down with podcast host...",3,Neutral
3233b819-2560-44c4-bdbb-62515a9659c2,SEAN HANNITY: Truth and common sense are making a comeback,"Fox News host Sean Hannity explains why he's grateful for President-elect Donald Trump's win in his opening monologue Tuesday on ""Hannity.""  SEAN HANNITY: The m...",5,Positive
8658ce41-8315-4089-8db1-1d0b084577db,'The View' co-host Sunny Hostin calls President Trump a 'DEI hire',"""The View"" co-host Sunny Hostin called President Donald Trump a ""DEI hire"" on Monday while reacting to his inauguration and pointed to the ""hypocrisy"" of his an...",5,Negative
0f2a01de-903e-43bb-9b8d-e0e484e82f91,DAVID MARCUS: Trump's McDonald’s visit served up four brilliant political moments,"NEW You can now listen to Fox News articles!  Presidential campaigns are known for iconic moments, and on Sunday beneath the Golden Arches, Donald Trump had ano...",2,Positive
a04a962d-938d-4bc0-af84-033d78d181b4,JESSE WATTERS: This is the most real American Cabinet the country has ever seen,"Fox News host Jesse Watters reflects on how President-elect Donald Trump is bringing people together to clean out the government on "" Jesse Watters Primetime .""...",5,Positive
9df06dc0-67b3-4a95-ae0d-9208db68711a,"FBI’s Trump probe ‘Arctic Frost’ also investigated Charlie Kirk’s TPUSA, Grassley reveals","NEW You can now listen to Fox News articles!  Senate Judiciary Committee Chairman Chuck Grassley, R-Iowa, revealed Tuesday that the FBI's election-related inves...",1,Positive
fd4a68c2-8812-4205-a4b9-9fadac8c8399,"Trump slams mail-in ballots as corrupt, but may not have the power to derail them",NEW You can now listen to Fox News articles!  President Trump told Brian Glenn of the conservative Real America’s Voice that he didn’t want to answer his qu...,2,Neutral
64eee2e5-2bee-4bd0-a6bc-f3d9b7795ab8,"UFC's Dana White hints that recently retired Jon Jones, Conor McGregor could return for White House fights",NEW You can now listen to Fox News articles!  President Donald Trump revealed plans last week to have a UFC card at the White House to celebrate the United Stat...,3,Neutral
a375c4cf-1698-49e0-9b40-178a6de791e1,Hungary's Orban ditches NATO summit to meet with Donald Trump,"Hungarian Prime Minister Viktor Orban departed the NATO summit in Washington, D.C., on Thursday to meet with Donald Trump in Florida, a source familiar with the...",4,Neutral
eab6ac9e-369f-4a2b-b523-8bacb8f45492,Brett Favre reveals Super Bowl LIX prediction – and it's similar to Trump's,"Pro Football Hall of Famer Brett Favre has made his pick for the winner of Super Bowl LIX.  Favre revealed his pick in a video post on X, but prefaced his predi...",3,Neutral
1776d37c-fd8f-4753-9d49-5170b7cc3401,Fox News ‘Antisemitism Exposed’ Newsletter: Trump Gets Peace Prize Push from Bibi,"NEW You can now listen to Fox News articles!  Fox News' ""Antisemitism Exposed"" newsletter brings you stories on the rising anti-Jewish prejudice across the U.S....",5,Positive
eb1cfbfc-c0d6-43a0-ad57-5a8884de1743,49ers player snaps on DNC after Trump's election victory: 'They're not learning',San Francisco 49ers long snapper Taybor Pepper slammed the Democratic National Committee following Vice President Kamala Harris’ loss to former President Dona...,5,Positive
1942535f-ddb3-44a5-b3ef-4b076ec7e03d,Trump expected to attend NASCAR's Daytona 500 after Super Bowl LIX appearance,"President Donald Trump was at Super Bowl LIX last weekend to see the Philadelphia Eagles clobber the Kansas City Chiefs, and on Sunday, he is expected to attend...",3,Neutral
6b3ddf4f-d62f-4981-beda-dc5e16dc28f1,SEAN HANNITY: No American should have to face a partisan witch hunt,"Fox News host Sean Hannity shreds politically motivated trials following the conviction of former President Trump on "" Hannity .""  SEAN HANNITY: No American, wh...",5,Positive
c6245c0c-7df0-4757-9e8f-a8b6e06947b7,Martha's Vineyard residents fume over arrests of illegal immigrants in liberal enclave,NEW You can now listen to Fox News articles!  Martha’s Vineyard residents are unhappy with the Trump administration deporting illegal immigrants from their li...,5,Negative
2ab04a3a-a9af-47fa-9b8b-96c242d2a721,New book details security lapses ahead of Trump assassination attempt: 'Clear there was a problem',"An upcoming book sheds further light on security lapses long before the first assassination attempt against President Donald Trump.  On Thursday, Vanity Fair re...",5,Positive
6c1db79d-2ab3-4cca-bec2-5a2959285511,"DAVID MARCUS: Trump understands that safety is for every citizen, not just the lucky few","NEW You can now listen to Fox News articles!  For decades, Washington, D.C. has been synonymous with crime, murder, and more recently vagrancy, but this week, P...",5,Positive
9dd0d8ff-4387-4be8-9a1a-8329442c57ff,JD Vance says Trump clashed with former officials for refusing to engage in 'ridiculous war',"Republican vice presidential candidate Sen. JD Vance, of Ohio argued that his running mate, former President Trump, has clashed with former Pentagon officials f...",2,Positive
368393d3-92a3-4337-b308-1904e7d59018,Nikki Haley and Charlamagne agree 'Morning Joe' co-hosts visited Trump because 'they saw the ratings tank',"Radio host Charlamagne Tha God and former GOP presidential candidate Nikki Haley said the ""Morning Joe"" co-hosts' controversial visit to the estate of President...",5,Positive
9d82d6f1-8327-48bb-b03f-d6811793346a,Trump credits Iran nuclear strikes for kickstarting Israel-Hamas peace deal,NEW You can now listen to Fox News articles!  President Donald Trump told Fox News in an exclusive interview Monday that he credits the U.S. strikes on key Iran...,4,Positive
af5f0906-2936-4c70-9222-defe03b0edd1,Miranda Devine: Trump is White House host with the most as he gives wide-ranging interview for debut podcast,"NEW You can now listen to Fox News articles!  When you meet Donald Trump, the first thing you notice is his hospitality. He is a bountiful host who always wants...",3,Positive
8180c9a7-c99b-4294-9ebd-d4768372d8ab,We're Democrats. Biden should not have pardoned Hunter. Now he should pardon Trump,"NEW You can now listen to Fox News articles!  As Democrats, we are deeply disappointed in President Joe Biden’s decision to offer a full and unconditional par...",5,Positive
93d1bc16-8d79-48f3-b6d3-f7b0a8808fa1,New Orleans jail escapee who begged Trump for help captured as manhunt targets last fugitive,NEW You can now listen to Fox News articles!  One remaining Orleans Parish prison escapee is still on the run after local and federal officials on Friday arrest...,5,Neutral
2a6a3c91-9764-4ac7-a349-2aa87114c53d,Former Obama fundraiser makes big prediction about 2024 race and Donald Trump: ‘I see him winning’,"Former Obama fundraiser Don Peebles contrasted Vice President Kamala Harris to the former president on Saturday, stating that Obama was inspiring and represente...",2,Positive
79e00bf8-84e1-4995-b92a-4360a7ca70e0,Shock number: Trump has higher approval rating in deep blue state than its governor,"Democratic Gov. Kathy Hochul’s favorability among likely New York voters has cratered, and former President Trump is viewed more favorably by voters in the hi...",2,Positive
1b78ad86-2d60-4556-835e-7b64bb7cbde8,Democratic Rep praises Trump for doing 'pretty darn well' on Middle East tour,"Rep. Jim Himes, D-Conn., offered rare praise for President Donald Trump Thursday, arguing he ""played the Middle East pretty darn well.""  Trump has received accl...",4,Positive
e2ad1aab-cb3d-458d-bba0-c6526d28ebab,More potential VP picks surface as Trump campaigns ahead of New Hampshire primary,"Read this article for free! Plus get unlimited access to thousands of articles, videos and more with your free account! Please enter a valid email address. By e...",2,Neutral
a43cbfc7-e62f-47b0-97d0-6e65329d3a9a,White House sending $9.4 billion DOGE cuts package to Congress next week,"The White House is expected to send a federal spending cut proposal to Congress next week, two Republican sources told Fox News Digital on Wednesday.  It's the ...",4,Neutral
ab4c005a-9589-4e35-92ec-30c1fe6d84e6,MSNBC host praises 'DEI' officials prosecuting Trump: 'Wonderfully poetic',"MSNBC host Joy Reid praised some of the Black public officials prosecuting former President Trump, saying Monday ""my DEIs are bringing it home.""  Manhattan Dist...",5,Negative
69c394b0-629c-466b-90a9-665c4e4419ba,Trump supporters outside Madison Square Garden say 'exhilarating' rally shows NY is in play,Ardent supporters of former President Trump say Sunday’s campaign rally at Madison Square Garden was a bold statement that their movement is penetrating deep ...,2,Positive
285ec662-c414-4994-b5eb-ebefd6bd7bd0,New migrant caravan making its way to border despite Trump taking office,"Just hours before President Donald Trump was sworn into office on Monday, a migrant caravan of more than 2,000 people set off from deep in southern Mexico with ...",5,Neutral
a5db7d40-8391-4e5d-be69-eb27a270f717,Trump reveals his gameplan for meeting with Putin in Alaska: 'It's like chess',NEW You can now listen to Fox News articles!  President Donald Trump revealed how he plans to approach his meeting with Russian President Vladimir Putin on Frid...,4,Neutral
14af194e-9465-4158-aa80-6799c4c19a7c,'The View' co-host says Trump would win by same margins if election held today,"NEW You can now listen to Fox News articles!  ""The View"" co-host Alyssa Farah Griffin suprised the panel Friday, arguing that even if many Americans feel the co...",2,Neutral
bca62c01-695f-4f0d-be57-a4aa37255d1e,"CNN's Jennings calls out student 'Hitlers,' antisemitism on college campuses: 'Open your eyes'",CNN commentator Scott Jennings addressed former Trump chief of staff John Kelly's claim that former President Trump once spoke favorably of Adolf Hitler on Tues...,5,Negative
5bfbc9f1-2f45-4749-8caa-a267558488e9,'Absolute bare minimum': Calls for more action after Secret Service agents suspended for security failure,NEW You can now listen to Fox News articles!  Following the suspension of six Secret Service agents tasked with protecting President Donald Trump at a campaign ...,5,Positive
b1c2c456-c800-4efd-94f2-77e096fed4cf,Bill Maher vows to do ‘everything he can’ to make sure Trump loses election,"HBO host Bill Maher claimed he would do ""everything he can"" to make sure former President Trump isn’t re-elected in 2024 in a new interview.  When asked speci...",5,Negative
ac4df3f8-c997-4770-96a5-0563025b5184,Daily Show pokes fun at Obama laughing with 'future Hitler' Trump during Carter funeral,"""The Daily Show"" mocked former President Obama and President-elect Donald Trump's friendly interactions Thursday at former President Jimmy Carter's state funera...",5,Negative
538fa144-eb94-4e46-bf71-a5a72eccce44,Melania Trump reflects on 'incredible' state of 2024 race just days from Election Day: Feels 'like 2016',"Former first lady Melania Trump expressed optimism surrounding the 2024 presidential race, comparing the energy to the 2016 election when former President Donal...",6,Positive
c0539cc7-fbd6-4c70-a9cf-a50c4ce76289,Ex-WWE star Mick Foley weighs in on Trump: 'Absolutely nothing fun about this man',Former President Donald Trump got the pro wrestling world talking when he appeared on The Undertaker’s podcast last week ahead of the 2024 presidential electi...,5,Negative
ee6ad2e7-caa4-4847-86d7-0e31fff200d6,CNN's Jennings gives constitutional lesson to fellow panelist worried about Trump controlling the military,CNN senior political commentator Scott Jennings educated a fellow panelist who suggested it was a point of fear that President Donald Trump gained control of th...,5,Positive
6cb3c56b-d457-4efa-b75c-73c52199d105,Trump sends message directly to millions of Americans after Biden’s ‘garbage’ insult and more top headlines,"Good morning and welcome to Fox News’ morning newsletter, Fox News First. And here's what you need to know to start your day ...  YOUR ELECTION HUB: Be a step...",2,Positive
7b74c11a-c257-43de-b81b-3654ca8558f2,"US tariff take surges to $31B in August, setting new monthly high for 2025","NEW You can now listen to Fox News articles!  The U.S. collected more than $30 billion in tariff revenues in August, already the highest monthly total so far fo...",4,Neutral
5238b7ef-00ba-4b71-ae2e-b8aeb55ce3c6,Biden admin Commerce Dept seeks to exhaust CHIPS Act funding before Biden leaves office,The Commerce Department is pushing to spend every dollar allocated under President Biden's CHIPS and Science Act before President-elect Donald Trump enters the ...,4,Neutral
